Title,Authors,FirstAuthor,FirstAuthorAffiliation,LastAuthor,LastAuthorAffiliation,LastAuthorEmail,LastAuthorHindex,Abstract,Journal,PublicationDate,Grant
Exercise for Patients With Hypertrophic Cardiomyopathy-Reply.,"['Saberi, Sara', 'Wheeler, Matthew', 'Day, Sharlene M']","Saberi, Sara",University of Michigan Medical School,"Day, Sharlene M",University of Michigan Medical School,,22,,JAMA,2017 Aug 1,
Dexmedetomidine in Patients With Sepsis Requiring Mechanical Ventilation-Reply.,"['Yamamura, Hitoshi', 'Kawazoe, Yu', 'Morimoto, Takeshi']","Yamamura, Hitoshi",Kindai University,"Morimoto, Takeshi",Hyogo College of Medicine,,36,,JAMA,2017 Aug 1,
Time to Diagnostic Testing After a Positive Colorectal Cancer Screening Test.,"['Doubeni, Chyke A', 'Corley, Douglas A', 'Levin, Theodore R']","Doubeni, Chyke A",University of Pennsylvania,"Levin, Theodore R",Permanente Medical Group,,49,,JAMA,2017 Aug 1,
Risks of Medical Metaphors.,"['Frush, Benjamin W', 'Eberly, John Brewer Jr']","Frush, Benjamin W",The University of North Carolina at Chapel Hill,"Eberly, John Brewer Jr",,,,,JAMA,2017 Aug 1,
Exercise for Patients With Hypertrophic Cardiomyopathy.,"['Soriano-Maldonado, Alberto', 'Vargas-Hitos, Jose A', 'Jimenez-Jaimez, Juan']","Soriano-Maldonado, Alberto",Universidad de Almeria,"Jimenez-Jaimez, Juan",Complejo Hospitalario Universitario de Granada,,5,,JAMA,2017 Aug 1,
Dexmedetomidine in Patients With Sepsis Requiring Mechanical Ventilation.,"['Scheer, Christian S', 'Kuhn, Sven-Olaf', 'Rehberg, Sebastian']","Scheer, Christian S",Universitätsmedizin Greifswald,"Rehberg, Sebastian",Universitatsklinikum Greifswald der Ernst-Moritz-Arndt-Universitat Greifswald,,21,,JAMA,2017 Aug 1,
Fees for Certification and Finances of Medical Specialty Boards.,"['Drolet, Brian C', 'Tandon, Vickram J']","Drolet, Brian C",Vanderbilt University,"Tandon, Vickram J","University of California, San Francisco",,7,,JAMA,2017 Aug 1,
Medical News: London Letter.,,,,,,,,,JAMA,2017 Aug 1,
State Flexibility for Medicaid: How Much?,"['Butler, Stuart M']","Butler, Stuart M",The Brookings Institution,"Butler, Stuart M",The Brookings Institution,,8,,JAMA,2017 Aug 1,
Costs and Outcomes of Mental Health and Substance Use Disorders in the US.,"['Kamal, Rabah', 'Cox, Cynthia', 'Rousseau, David']","Kamal, Rabah",Arizona State University,"Rousseau, David",Laboratoire de l'Accelerateur Lineaire,,83,,JAMA,2017 Aug 1,
Viral Testing for Pediatric Respiratory Infections: Why Precise Diagnoses Do Not Always Translate to Patient Benefit.,"['Schroeder, Alan R', 'Ralston, Shawn L']","Schroeder, Alan R",Stanford University,"Ralston, Shawn L",Dartmouth College,,19,,JAMA,2017 Aug 1,
Extended-Release ADHD Drug.,"['Voelker, Rebecca']","Voelker, Rebecca",MSJ,"Voelker, Rebecca",MSJ,,15,,JAMA,2017 Aug 1,
Another Fluoroquinolone Approved.,"['Voelker, Rebecca']","Voelker, Rebecca",MSJ,"Voelker, Rebecca",MSJ,,15,,JAMA,2017 Aug 1,
New Hereditary Angioedema Therapy.,"['Voelker, Rebecca']","Voelker, Rebecca",MSJ,"Voelker, Rebecca",MSJ,,15,,JAMA,2017 Aug 1,
"Corticosteroids for IgA Nephropathy: TESTING for Benefit, Discovering Harm.","[""O'Shaughnessy, Michelle M"", 'Lafayette, Richard A']","O'Shaughnessy, Michelle M",Stanford University School of Medicine,"Lafayette, Richard A",Stanford University School of Medicine,,21,,JAMA,2017 Aug 1,
24-Hour Urine Calcium in the Evaluation and Management of Nephrolithiasis.,"['Song, Li', 'Maalouf, Naim M']","Song, Li",University of Science and Technology of China,"Maalouf, Naim M",UT Southwestern Medical School,,27,,JAMA,2017 Aug 1,
CRISPR-Based System Uncovers Key Regulators of Disease-Related Genes.,"['Hampton, Tracy']","Hampton, Tracy",,"Hampton, Tracy",,,15,,JAMA,2017 Aug 1,
Diagnostic Stewardship-Leveraging the Laboratory to Improve Antimicrobial Use.,"['Morgan, Daniel J', 'Malani, Preeti', 'Diekema, Daniel J']","Morgan, Daniel J",University of Maryland School of Medicine,"Diekema, Daniel J",University of Iowa Carver College of Medicine,,78,,JAMA,2017 Aug 15,
Health and Spirituality.,"['VanderWeele, Tyler J', 'Balboni, Tracy A', 'Koh, Howard K']","VanderWeele, Tyler J",Harvard School of Public Health,"Koh, Howard K",Harvard School of Public Health,,47,,JAMA,2017 Aug 8,
Challenges in International Comparison of Health Care Systems.,"['Papanicolas, Irene', 'Jha, Ashish K']","Papanicolas, Irene",Harvard School of Public Health,"Jha, Ashish K",Harvard School of Public Health,,66,,JAMA,2017 Aug 8,
"Half-century After ""Summer of Love,"" Free Clinics Still Play Vital Role.","['Rubin, Rita']","Rubin, Rita",Independent journalist,"Rubin, Rita",Independent journalist,,5,,JAMA,2017 Aug 15,
Decline in Student Tobacco Use.,,,,,,,,,JAMA,2017 Jul 25,
Deceptive Lyme Disease Diagnosis Linked With Serious Infections.,,,,,,,,,JAMA,2017 Jul 25,
And Then Came the PACS.,"['Hise, Joseph Henry']","Hise, Joseph Henry",Baylor University Medical Center at Dallas,"Hise, Joseph Henry",Baylor University Medical Center at Dallas,,10,,JAMA,2017 Jul 25,
Plantar Fasciitis.,"['Muth, Christopher C']","Muth, Christopher C",Journal of American Medical Association,"Muth, Christopher C",Journal of American Medical Association,,2,,JAMA,2017 Jul 25,
The Effect of Nursing Quality Improvement and Mobile Health Interventions on Infant Sleep Practices: A Randomized Clinical Trial.,"['Moon, Rachel Y', 'Hauck, Fern R', 'Colson, Eve R', 'Kellams, Ann L', 'Geller, Nicole L', 'Heeren, Timothy', 'Kerr, Stephen M', 'Drake, Emily E', 'Tanabe, Kawai', 'McClain, Mary', 'Corwin, Michael J']","Moon, Rachel Y",University of Virginia Medical School,"Corwin, Michael J",Boston University - Slone Epidemiology Unit,,34,"Importance: Inadequate adherence to recommendations known to reduce the risk of sudden unexpected infant death has contributed to a slowing in the decline of these deaths. Objective: To assess the effectiveness of 2 interventions separately and combined to promote infant safe sleep practices compared with control interventions. Design, Setting, and Participants: Four-group cluster randomized clinical trial of mothers of healthy term newborns who were recruited between March 2015 and May 2016 at 16 US hospitals with more than 100 births annually. Data collection ended in October 2016. Interventions: All participants were beneficiaries of a nursing quality improvement campaign in infant safe sleep practices (intervention) or breastfeeding (control), and then received a 60-day mobile health program, in which mothers received frequent emails or text messages containing short videos with educational content about infant safe sleep practices (intervention) or breastfeeding (control) and queries about infant care practices. Main Outcomes and Measures: The primary outcome was maternal self-reported adherence to 4 infant safe sleep practices of sleep position (supine), sleep location (room sharing without bed sharing), soft bedding use (none), and pacifier use (any); data were collected by maternal survey when the infant was aged 60 to 240 days. Results: Of the 1600 mothers who were randomized to 1 of 4 groups (400 per group), 1263 completed the survey (78.9%). The mean (SD) maternal age was 28.1 years (5.8 years) and 32.8% of respondents were non-Hispanic white, 32.3% Hispanic, 27.2% non-Hispanic black, and 7.7% other race/ethnicity. The mean (SD) infant age was 11.2 weeks (4.4 weeks) and 51.2% were female. In the adjusted analyses, mothers receiving the safe sleep mobile health intervention had higher prevalence of placing their infants supine compared with mothers receiving the control mobile health intervention (89.1% vs 80.2%, respectively; adjusted risk difference, 8.9% [95% CI, 5.3%-11.7%]), room sharing without bed sharing (82.8% vs 70.4%; adjusted risk difference, 12.4% [95% CI, 9.3%-15.1%]), no soft bedding use (79.4% vs 67.6%; adjusted risk difference, 11.8% [95% CI, 8.1%-15.2%]), and any pacifier use (68.5% vs 59.8%; adjusted risk difference, 8.7% [95% CI, 3.9%-13.1%]). The independent effect of the nursing quality improvement intervention was not significant for all outcomes. Interactions between the 2 interventions were only significant for the supine sleep position. Conclusions and Relevance: Among mothers of healthy term newborns, a mobile health intervention, but not a nursing quality improvement intervention, improved adherence to infant safe sleep practices compared with control interventions. Whether widespread implementation is feasible or if it reduces sudden and unexpected infant death rates remains to be studied. Trial Registration: clinicaltrials.gov Identifier: NCT01713868.",JAMA,2017 Jul 25,['R01 HD072815/HD/NICHD NIH HHS/United States']
Association of Genetic Variants Related to Serum Calcium Levels With Coronary Artery Disease and Myocardial Infarction.,"['Larsson, Susanna C', 'Burgess, Stephen', 'Michaelsson, Karl']","Larsson, Susanna C",Karolinska Institutet,"Michaelsson, Karl",Uppsala Universitet,,55,"Importance: Serum calcium has been associated with cardiovascular disease in observational studies and evidence from randomized clinical trials indicates that calcium supplementation, which raises serum calcium levels, may increase the risk of cardiovascular events, particularly myocardial infarction. Objective: To evaluate the potential causal association between genetic variants related to elevated serum calcium levels and risk of coronary artery disease (CAD) and myocardial infarction using mendelian randomization. Design, Setting, and Participants: The analyses were performed using summary statistics obtained for single-nucleotide polymorphisms (SNPs) identified from a genome-wide association meta-analysis of serum calcium levels (N = up to 61079 individuals) and from the Coronary Artery Disease Genome-wide Replication and Meta-analysis Plus the Coronary Artery Disease Genetics (CardiogramplusC4D) consortium's 1000 genomes-based genome-wide association meta-analysis (N = up to 184305 individuals) that included cases (individuals with CAD and myocardial infarction) and noncases, with baseline data collected from 1948 and populations derived from across the globe. The association of each SNP with CAD and myocardial infarction was weighted by its association with serum calcium, and estimates were combined using an inverse-variance weighted meta-analysis. Exposures: Genetic risk score based on genetic variants related to elevated serum calcium levels. Main Outcomes and Measures: Co-primary outcomes were the odds of CAD and myocardial infarction. Results: Among the mendelian randomized analytic sample of 184305 individuals (60801 CAD cases [approximately 70% with myocardial infarction] and 123504 noncases), the 6 SNPs related to serum calcium levels and without pleiotropic associations with potential confounders were estimated to explain about 0.8% of the variation in serum calcium levels. In the inverse-variance weighted meta-analysis (combining the estimates of the 6 SNPs), the odds ratios per 0.5-mg/dL increase (about 1 SD) in genetically predicted serum calcium levels were 1.25 (95% CI, 1.08-1.45; P = .003) for CAD and 1.24 (95% CI, 1.05-1.46; P = .009) for myocardial infarction. Conclusions and Relevance: A genetic predisposition to higher serum calcium levels was associated with increased risk of CAD and myocardial infarction. Whether the risk of CAD associated with lifelong genetic exposure to increased serum calcium levels can be translated to a risk associated with short-term to medium-term calcium supplementation is unknown.",JAMA,2017 Jul 25,"['MR/L003120/1/Medical Research Council/United Kingdom', 'RG/08/014/24067/British Heart Foundation/United Kingdom']"
Targeted Temperature Management for 48 vs 24 Hours and Neurologic Outcome After Out-of-Hospital Cardiac Arrest: A Randomized Clinical Trial.,"['Kirkegaard, Hans', 'Soreide, Eldar', 'de Haas, Inge', 'Pettila, Ville', 'Taccone, Fabio Silvio', 'Arus, Urmet', 'Storm, Christian', 'Hassager, Christian', 'Nielsen, Jorgen Feldbaek', 'Sorensen, Christina Ankjaer', 'Ilkjaer, Susanne', 'Jeppesen, Anni Norgaard', 'Grejs, Anders Morten', 'Duez, Christophe Henri Valdemar', 'Hjort, Jakob', 'Larsen, Alf Inge', 'Toome, Valdo', 'Tiainen, Marjaana', 'Hastbacka, Johanna', 'Laitio, Timo', 'Skrifvars, Markus B']","Kirkegaard, Hans",Arhus Universitetshospital,"Skrifvars, Markus B",Helsingin Yliopisto,,24,"Importance: International resuscitation guidelines recommend targeted temperature management (TTM) at 33 degrees C to 36 degrees C in unconscious patients with out-of-hospital cardiac arrest for at least 24 hours, but the optimal duration of TTM is uncertain. Objective: To determine whether TTM at 33 degrees C for 48 hours results in better neurologic outcomes compared with currently recommended, standard, 24-hour TTM. Design, Setting, and Participants: This was an international, investigator-initiated, blinded-outcome-assessor, parallel, pragmatic, multicenter, randomized clinical superiority trial in 10 intensive care units (ICUs) at 10 university hospitals in 6 European countries. Three hundred fifty-five adult, unconscious patients with out-of-hospital cardiac arrest were enrolled from February 16, 2013, to June 1, 2016, with final follow-up on December 27, 2016. Interventions: Patients were randomized to TTM (33 +/- 1 degrees C) for 48 hours (n = 176) or 24 hours (n = 179), followed by gradual rewarming of 0.5 degrees C per hour until reaching 37 degrees C. Main Outcomes and Measures: The primary outcome was 6-month neurologic outcome, with a Cerebral Performance Categories (CPC) score of 1 or 2 used to define favorable outcome. Secondary outcomes included 6-month mortality, including time to death, the occurrence of adverse events, and intensive care unit resource use. Results: In 355 patients who were randomized (mean age, 60 years; 295 [83%] men), 351 (99%) completed the trial. Of these patients, 69% (120/175) in the 48-hour group had a favorable outcome at 6 months compared with 64% (112/176) in the 24-hour group (difference, 4.9%; 95% CI, -5% to 14.8%; relative risk [RR], 1.08; 95% CI, 0.93-1.25; P = .33). Six-month mortality was 27% (48/175) in the 48-hour group and 34% (60/177) in the 24-hour group (difference, -6.5%; 95% CI, -16.1% to 3.1%; RR, 0.81; 95% CI, 0.59-1.11; P = .19). There was no significant difference in the time to mortality between the 48-hour group and the 24-hour group (hazard ratio, 0.79; 95% CI, 0.54-1.15; P = .22). Adverse events were more common in the 48-hour group (97%) than in the 24-hour group (91%) (difference, 5.6%; 95% CI, 0.6%-10.6%; RR, 1.06; 95% CI, 1.01-1.12; P = .04). The median length of intensive care unit stay (151 vs 117 hours; P < .001), but not hospital stay (11 vs 12 days; P = .50), was longer in the 48-hour group than in the 24-hour group. Conclusions and Relevance: In unconscious survivors from out-of-hospital cardiac arrest admitted to the ICU, targeted temperature management at 33 degrees C for 48 hours did not significantly improve 6-month neurologic outcome compared with targeted temperature management at 33 degrees C for 24 hours. However, the study may have had limited power to detect clinically important differences, and further research may be warranted. Trial Registration: clinicaltrials.gov Identifier: NCT01689077.",JAMA,2017 Jul 25,
Clinicopathological Evaluation of Chronic Traumatic Encephalopathy in Players of American Football.,"['Mez, Jesse', 'Daneshvar, Daniel H', 'Kiernan, Patrick T', 'Abdolmohammadi, Bobak', 'Alvarez, Victor E', 'Huber, Bertrand R', 'Alosco, Michael L', 'Solomon, Todd M', 'Nowinski, Christopher J', 'McHale, Lisa', 'Cormier, Kerry A', 'Kubilus, Caroline A', 'Martin, Brett M', 'Murphy, Lauren', 'Baugh, Christine M', 'Montenigro, Phillip H', 'Chaisson, Christine E', 'Tripodis, Yorghos', 'Kowall, Neil W', 'Weuve, Jennifer', 'McClean, Michael D', 'Cantu, Robert C', 'Goldstein, Lee E', 'Katz, Douglas I', 'Stern, Robert A', 'Stein, Thor D', 'McKee, Ann C']","Mez, Jesse",Boston University School of Medicine,"McKee, Ann C",VA Medical Center,,66,"Importance: Players of American football may be at increased risk of long-term neurological conditions, particularly chronic traumatic encephalopathy (CTE). Objective: To determine the neuropathological and clinical features of deceased football players with CTE. Design, Setting, and Participants: Case series of 202 football players whose brains were donated for research. Neuropathological evaluations and retrospective telephone clinical assessments (including head trauma history) with informants were performed blinded. Online questionnaires ascertained athletic and military history. Exposures: Participation in American football at any level of play. Main Outcomes and Measures: Neuropathological diagnoses of neurodegenerative diseases, including CTE, based on defined diagnostic criteria; CTE neuropathological severity (stages I to IV or dichotomized into mild [stages I and II] and severe [stages III and IV]); informant-reported athletic history and, for players who died in 2014 or later, clinical presentation, including behavior, mood, and cognitive symptoms and dementia. Results: Among 202 deceased former football players (median age at death, 66 years [interquartile range, 47-76 years]), CTE was neuropathologically diagnosed in 177 players (87%; median age at death, 67 years [interquartile range, 52-77 years]; mean years of football participation, 15.1 [SD, 5.2]), including 0 of 2 pre-high school, 3 of 14 high school (21%), 48 of 53 college (91%), 9 of 14 semiprofessional (64%), 7 of 8 Canadian Football League (88%), and 110 of 111 National Football League (99%) players. Neuropathological severity of CTE was distributed across the highest level of play, with all 3 former high school players having mild pathology and the majority of former college (27 [56%]), semiprofessional (5 [56%]), and professional (101 [86%]) players having severe pathology. Among 27 participants with mild CTE pathology, 26 (96%) had behavioral or mood symptoms or both, 23 (85%) had cognitive symptoms, and 9 (33%) had signs of dementia. Among 84 participants with severe CTE pathology, 75 (89%) had behavioral or mood symptoms or both, 80 (95%) had cognitive symptoms, and 71 (85%) had signs of dementia. Conclusions and Relevance: In a convenience sample of deceased football players who donated their brains for research, a high proportion had neuropathological evidence of CTE, suggesting that CTE may be related to prior participation in football.",JAMA,2017 Jul 25,"['K23 AG046377/AG/NIA NIH HHS/United States', 'P30 AG013846/AG/NIA NIH HHS/United States', 'U01 NS086659/NS/NINDS NIH HHS/United States']"
Blended CBT Controls Anxiety in Cancer Survivors.,"['Slomski, Anita']","Slomski, Anita",Columbia University School of Nursing,"Slomski, Anita",Columbia University School of Nursing,,3,,JAMA,2017 Jul 25,
Dual Strategy Increases Colorectal Cancer Screening.,"['Slomski, Anita']","Slomski, Anita",Columbia University School of Nursing,"Slomski, Anita",Columbia University School of Nursing,,3,,JAMA,2017 Jul 25,
Combination Therapy Shrinks Melanoma Brain Metastases.,"['Slomski, Anita']","Slomski, Anita",Columbia University School of Nursing,"Slomski, Anita",Columbia University School of Nursing,,3,,JAMA,2017 Jul 25,
Parent-Based Therapy Helps Children Lose Weight.,"['Slomski, Anita']","Slomski, Anita",Columbia University School of Nursing,"Slomski, Anita",Columbia University School of Nursing,,3,,JAMA,2017 Jul 25,
Fewer Seizures With Cannabidiol in Catastrophic Epilepsy.,"['Slomski, Anita']","Slomski, Anita",Columbia University School of Nursing,"Slomski, Anita",Columbia University School of Nursing,,3,,JAMA,2017 Jul 25,
Increases in Thyroid Cancer Incidence and Mortality-Reply.,"['Kitahara, Cari M', 'Devesa, Susan S', 'Sosa, Julie A']","Kitahara, Cari M",National Cancer Institute,"Sosa, Julie A",Duke University School of Medicine,,47,,JAMA,2017 Jul 25,
Deep Brain Stimulation for Obsessive-Compulsive Disorder-Reply.,"['Hirschtritt, Matthew E', 'Bloch, Michael H', 'Mathews, Carol A']","Hirschtritt, Matthew E","University of California, San Francisco","Mathews, Carol A",University of Florida College of Medicine,,21,,JAMA,2017 Jul 25,
Nonclinical Factors Affecting Shared Decision Making-Reply.,"['Spatz, Erica S', 'Moulton, Benjamin W', 'Krumholz, Harlan M']","Spatz, Erica S",Yale University,"Krumholz, Harlan M",Yale-New Haven Hospital,,136,,JAMA,2017 Jul 25,
Increases in Thyroid Cancer Incidence and Mortality.,"['Davies, Louise', 'Morris, Luc', 'Hankey, Benjamin']","Davies, Louise",White River Junction VA Medical Center,"Hankey, Benjamin",CANSTAT,,42,,JAMA,2017 Jul 25,
Deep Brain Stimulation for Obsessive-Compulsive Disorder.,"['Kohl, Sina', 'Kuhn, Jens']","Kohl, Sina",University of Cambridge,"Kuhn, Jens",University Medicine Greifswald,,34,,JAMA,2017 Jul 25,
Nonclinical Factors Affecting Shared Decision Making.,"['Smith, Grace L', 'Volk, Robert J']","Smith, Grace L",University of Texas MD Anderson Cancer Center,"Volk, Robert J",University of Texas MD Anderson Cancer Center,,36,,JAMA,2017 Jul 25,['P30 CA016672/CA/NCI NIH HHS/United States']
Association of the Priority Review Voucher With Neglected Tropical Disease Drug and Vaccine Development.,"['Jain, Nina', 'Hwang, Thomas', 'Franklin, Jessica M', 'Kesselheim, Aaron S']","Jain, Nina",University of North Carolina School of Medicine,"Kesselheim, Aaron S",Brigham and Women's Hospital,,37,,JAMA,2017 Jul 25,
Domestic Correspondence: Laboratory Work in Medical Schools.,,,,,,,,,JAMA,2017 Jul 25,
Why Is US Maternal Mortality Rising?,"['Carroll, Aaron E']","Carroll, Aaron E",Indiana University School of Medicine Indianapolis,"Carroll, Aaron E",Indiana University School of Medicine Indianapolis,,27,,JAMA,2017 Jul 25,
Cascade Screening for Familial Hypercholesterolemia and the Use of Genetic Testing.,"['Knowles, Joshua W', 'Rader, Daniel J', 'Khoury, Muin J']","Knowles, Joshua W",Stanford University,"Khoury, Muin J",Coordinating Center for Health Promotion,,88,,JAMA,2017 Jul 25,
New Medical Officer at Indian Health Service.,"['Lyon, Jeff']","Lyon, Jeff",Walter Reed Army Institute of Research,"Lyon, Jeff",Walter Reed Army Institute of Research,,30,,JAMA,2017 Jul 25,
Cancer Project Speeding Along.,"['Lyon, Jeff']","Lyon, Jeff",Walter Reed Army Institute of Research,"Lyon, Jeff",Walter Reed Army Institute of Research,,30,,JAMA,2017 Jul 25,
Chikungunya Vaccine Trials Begin.,"['Lyon, Jeff']","Lyon, Jeff",Walter Reed Army Institute of Research,"Lyon, Jeff",Walter Reed Army Institute of Research,,30,,JAMA,2017 Jul 25,
Interventions to Improve Infant Safe Sleep Practices.,"['Shapiro-Mendoza, Carrie K']","Shapiro-Mendoza, Carrie K",National Center for Chronic Disease Prevention and Health Promotion,"Shapiro-Mendoza, Carrie K",National Center for Chronic Disease Prevention and Health Promotion,,27,,JAMA,2017 Jul 25,['CC999999/Intramural CDC HHS/United States']
Advances and Gaps in Understanding Chronic Traumatic Encephalopathy: From Pugilists to American Football Players.,"['Rabinovici, Gil D']","Rabinovici, Gil D","University of California, San Francisco","Rabinovici, Gil D","University of California, San Francisco",,44,,JAMA,2017 Jul 25,
Targeted Temperature Management After Cardiac Arrest: Finding the Right Dose for Critical Care Interventions.,"['Callaway, Clifton W']","Callaway, Clifton W",University of Pittsburgh School of Medicine,"Callaway, Clifton W",University of Pittsburgh School of Medicine,,63,,JAMA,2017 Jul 25,"['U10 NS080371/NS/NINDS NIH HHS/United States', 'U01 HL133818/HL/NHLBI NIH HHS/United States', 'UH2 HL125163/HL/NHLBI NIH HHS/United States', 'K12 HL109068/HL/NHLBI NIH HHS/United States', 'U01 HL077871/HL/NHLBI NIH HHS/United States']"
Practical Improvements for Medical Device Evaluation.,"['Kramer, Daniel B', 'Yeh, Robert W']","Kramer, Daniel B",Beth Israel Deaconess Medical Center,"Yeh, Robert W",Beth Israel Deaconess Medical Center,,33,,JAMA,2017 Jul 25,['K23 AG045963/AG/NIA NIH HHS/United States']
Metanephrines for Evaluating Palpitations and Flushing.,"['Hannah-Shmouni, Fady', 'Pacak, Karel', 'Stratakis, Constantine A']","Hannah-Shmouni, Fady",National Institute of Child Health and Human Development,"Stratakis, Constantine A",National Institute of Child Health and Human Development,,74,,JAMA,2017 Jul 25,
"Epistaxis, Ecchymoses, and an Abnormal White Blood Cell Count.","['Sellers, Meredith H', 'Dinner, Shira N']","Sellers, Meredith H",Vanderbilt University School of Medicine,"Dinner, Shira N",Northwestern University Feinberg School of Medicine,,6,,JAMA,2017 Jul 25,
Treatment of Cholesterol in 2017.,"['Krumholz, Harlan M']","Krumholz, Harlan M",Yale-New Haven Hospital,"Krumholz, Harlan M",Yale-New Haven Hospital,,136,,JAMA,2017 Aug 1,
Inconsistent Guideline Recommendations for Cardiovascular Prevention and the Debate About Zeroing in on and Zeroing LDL-C Levels With PCSK9 Inhibitors.,"['Ioannidis, John P A']","Ioannidis, John P A",Stanford University School of Medicine,"Ioannidis, John P A",Stanford University School of Medicine,,138,,JAMA,2017 Aug 1,
Shared Vision.,"['Wicks, Ian']","Wicks, Ian",Royal Melbourne Hospital,"Wicks, Ian",Royal Melbourne Hospital,,41,,JAMA,2017 Jun 27,
The United Kingdom Sets Limits on Experimental Treatments: The Case of Charlie Gard.,"['Truog, Robert D']","Truog, Robert D",Harvard Medical School,"Truog, Robert D",Harvard Medical School,,49,,JAMA,2017 Sep 19,
Unintended Consequences of Machine Learning in Medicine.,"['Cabitza, Federico', 'Rasoini, Raffaele', 'Gensini, Gian Franco']","Cabitza, Federico",Universita degli Studi di Milano - Bicocca,"Gensini, Gian Franco",Azienda Ospedaliera Careggi,,68,,JAMA,2017 Aug 8,
"In Treating Sepsis, Questions About Timing and Mandates.","['Abbasi, Jennifer']","Abbasi, Jennifer",Journal of American Medical Association,"Abbasi, Jennifer",Journal of American Medical Association,,4,,JAMA,2017 Aug 8,
