Title,Authors,FirstAuthor,FirstAuthorAffiliation,LastAuthor,LastAuthorAffiliation,LastAuthorEmail,LastAuthorHindex,Abstract,Journal,PublicationDate,Grant
Postmarket Safety Events Among Novel Therapeutics Approved by the US Food and Drug Administration Between 2001 and 2010.,"['Downing, Nicholas S', 'Shah, Nilay D', 'Aminawung, Jenerius A', 'Pease, Alison M', 'Zeitoun, Jean-David', 'Krumholz, Harlan M', 'Ross, Joseph S']","Downing, Nicholas S",Yale University,"Ross, Joseph S",Yale University School of Medicine,,45,"Importance: Postmarket safety events of novel pharmaceuticals and biologics occur when new safety risks are identified after initial regulatory approval of these therapeutics. These safety events can change how novel therapeutics are used in clinical practice and inform patient and clinician decision making. Objectives: To characterize the frequency of postmarket safety events among novel therapeutics approved by the US Food and Drug Administration (FDA), and to examine whether any novel therapeutic characteristics known at the time of FDA approval were associated with increased risk. Design and Setting: Cohort study of all novel therapeutics approved by the FDA between January 1, 2001, and December 31, 2010, followed up through February 28, 2017. Exposures: Novel therapeutic characteristics known at the time of FDA approval, including drug class, therapeutic area, priority review, accelerated approval, orphan status, near-regulatory deadline approval, and regulatory review time. Main Outcomes and Measures: A composite of (1) withdrawals due to safety concerns, (2) FDA issuance of incremental boxed warnings added in the postmarket period, and (3) FDA issuance of safety communications. Results: From 2001 through 2010, the FDA approved 222 novel therapeutics (183 pharmaceuticals and 39 biologics). There were 123 new postmarket safety events (3 withdrawals, 61 boxed warnings, and 59 safety communications) during a median follow-up period of 11.7 years (interquartile range [IQR], 8.7-13.8 years), affecting 71 (32.0%) of the novel therapeutics. The median time from approval to first postmarket safety event was 4.2 years (IQR, 2.5-6.0 years), and the proportion of novel therapeutics affected by a postmarket safety event at 10 years was 30.8% (95% CI, 25.1%-37.5%). In multivariable analysis, postmarket safety events were statistically significantly more frequent among biologics (incidence rate ratio [IRR] = 1.93; 95% CI, 1.06-3.52; P = .03), therapeutics indicated for the treatment of psychiatric disease (IRR = 3.78; 95% CI, 1.77-8.06; P < .001), those receiving accelerated approval (IRR = 2.20; 95% CI, 1.15-4.21; P = .02), and those with near-regulatory deadline approval (IRR = 1.90; 95% CI, 1.19-3.05; P = .008); events were statistically significantly less frequent among those with regulatory review times less than 200 days (IRR = 0.46; 95% CI, 0.24-0.87; P = .02). Conclusions and Relevance: Among 222 novel therapeutics approved by the FDA from 2001 through 2010, 32% were affected by a postmarket safety event. Biologics, psychiatric therapeutics, and accelerated and near-regulatory deadline approval were statistically significantly associated with higher rates of events, highlighting the need for continuous monitoring of the safety of novel therapeutics throughout their life cycle.",JAMA,2017 May 9,['UL1 TR001863/TR/NCATS NIH HHS/United States']
Selumetinib Plus Docetaxel Compared With Docetaxel Alone and Progression-Free Survival in Patients With KRAS-Mutant Advanced Non-Small Cell Lung Cancer: The SELECT-1 Randomized Clinical Trial.,"['Janne, Pasi A', 'van den Heuvel, Michel M', 'Barlesi, Fabrice', 'Cobo, Manuel', 'Mazieres, Julien', 'Crino, Lucio', 'Orlov, Sergey', 'Blackhall, Fiona', 'Wolf, Juergen', 'Garrido, Pilar', 'Poltoratskiy, Artem', 'Mariani, Gabriella', 'Ghiorghiu, Dana', 'Kilgour, Elaine', 'Smith, Paul', 'Kohlmann, Alexander', 'Carlile, David J', 'Lawrence, David', 'Bowen, Karin', 'Vansteenkiste, Johan']","Janne, Pasi A",Dana-Farber Cancer Institute,"Vansteenkiste, Johan",KU Leuven University Hospital Leuven,,59,"Importance: There are no specifically approved targeted therapies for the most common genomically defined subset of non-small cell lung cancer (NSCLC), KRAS-mutant lung cancer. Objective: To compare efficacy of the mitogen-activated protein kinase kinase (MEK) inhibitor selumetinib + docetaxel with docetaxel alone as a second-line therapy for advanced KRAS-mutant NSCLC. Design, Setting, and Participants: Multinational, randomized clinical trial conducted at 202 sites across 25 countries from October 2013 through January 2016. Of 3323 patients with advanced NSCLC and disease progression following first-line anticancer therapy tested for a KRAS mutation, 866 were enrolled and 510 randomized. Primary reason for exclusion was ineligibility. The data cutoff date for analysis was June 7, 2016. Interventions: Patients were randomized 1:1; 254 to receive selumetinib + docetaxel and 256 to receive placebo + docetaxel. Main Outcomes and Measures: Primary end point was investigator assessed progression-free survival. Secondary end points included overall survival, objective response rate, duration of response, effects on disease-related symptoms, safety, and tolerability. Results: Of 510 randomized patients (mean age, 61.4 years [SD, 8.3]; women, 207 [41%]), 505 patients (99%) received treatment and completed the study (251 received selumetinib + docetaxel; 254 received placebo + docetaxel). At the time of data cutoff, 447 patients (88%) had experienced a progression event and 346 deaths (68%) had occurred. Median progression-free survival was 3.9 months (interquartile range [IQR], 1.5-5.9) with selumetinib + docetaxel and 2.8 months (IQR, 1.4-5.5) with placebo + docetaxel (difference, 1.1 months; hazard ratio [HR], 0.93 [95% CI, 0.77-1.12]; P = .44). Median overall survival was 8.7 months (IQR, 3.6-16.8) with selumetinib + docetaxel and 7.9 months (IQR, 3.8-20.1) with placebo + docetaxel (difference, 0.9 months; HR, 1.05 [95% CI, 0.85-1.30]; P = .64). Objective response rate was 20.1% with selumetinib + docetaxel and 13.7% with placebo + docetaxel (difference, 6.4%; odds ratio, 1.61 [95% CI, 1.00-2.62]; P = .05). Median duration of response was 2.9 months (IQR, 1.7-4.8; 95% CI, 2.7-4.1) with selumetinib + docetaxel and 4.5 months (IQR, 2.3-7.3; 95% CI, 2.8-5.6) with placebo + docetaxel. Adverse events of grade 3 or higher were more frequent with selumetinib + docetaxel (169 adverse events [67%] for selumetinib + docetaxel vs 115 adverse events [45%] for placebo + docetaxel; difference, 22%). Conclusions and Relevance: Among patients with previously treated advanced KRAS-mutant non-small cell lung cancer, addition of selumetinib to docetaxel did not improve progression-free survival compared with docetaxel alone. Trial Registration: clinicaltrials.gov: NCT01933932.",JAMA,2017 May 9,
Farewell to a Cancer That Never Was.,"['Lyon, Jeff']","Lyon, Jeff",Walter Reed Army Institute of Research,"Lyon, Jeff",Walter Reed Army Institute of Research,,30,,JAMA,2017 May 9,
Legal Complexities of Global Vaccine Compensation Systems-Reply.,"['Halabi, Sam F', 'Omer, Saad B']","Halabi, Sam F",University of Missouri-Columbia,"Omer, Saad B",Emory University,,40,,JAMA,2017 May 9,
Outlier in Analysis of Cancer Mortality by US County-Reply.,"['Mokdad, Ali H', 'Dwyer-Lindgren, Laura', 'Murray, Christopher J L']","Mokdad, Ali H","University of Washington, Seattle","Murray, Christopher J L","University of Washington, Seattle",,108,,JAMA,2017 May 9,
Use of the qSOFA Score in the Emergency Department-Reply.,"['Freund, Yonathan', 'Bloom, Ben', 'Riou, Bruno']","Freund, Yonathan",Sorbonne Université,"Riou, Bruno",Sorbonne Universite,,54,,JAMA,2017 May 9,
Legal Complexities of Global Vaccine Compensation Systems.,"['Mastroianni, Anna C', 'Henry, Leslie Meltzer']","Mastroianni, Anna C","University of Washington, Seattle","Henry, Leslie Meltzer",Johns Hopkins University,,5,,JAMA,2017 May 9,
Outlier in Analysis of Cancer Mortality by US County.,"['Hall, Jaclyn M', 'Shenkman, Elizabeth A', 'Fu, Chiung-Shiuan']","Hall, Jaclyn M",University of Florida,"Fu, Chiung-Shiuan",University of Florida,,2,,JAMA,2017 May 9,
Use of the qSOFA Score in the Emergency Department.,"['Scheer, Christian S', 'Kuhn, Sven-Olaf', 'Rehberg, Sebastian']","Scheer, Christian S",Universitätsmedizin Greifswald,"Rehberg, Sebastian",Universitatsklinikum Greifswald der Ernst-Moritz-Arndt-Universitat Greifswald,,21,,JAMA,2017 May 9,
Association Between Long-term Quinine Exposure and All-Cause Mortality.,"['Fardet, Laurence', 'Nazareth, Irwin', 'Petersen, Irene']","Fardet, Laurence",Hopital Henri Mondor,"Petersen, Irene",UCL,,35,,JAMA,2017 May 9,
Medicolegal.,,,,,,,,,JAMA,2017 May 9,
Finding the Rare Pathogenic Variants in a Human Genome.,"['Evans, James P', 'Powell, Bradford C', 'Berg, Jonathan S']","Evans, James P",University of North Carolina School of Medicine,"Berg, Jonathan S",University of North Carolina School of Medicine,,35,,JAMA,2017 May 9,
How to Look for Thyroid Cancer.,"['Cappola, Anne R']","Cappola, Anne R",University of Pennsylvania,"Cappola, Anne R",University of Pennsylvania,,41,,JAMA,2017 May 9,
Treatment of KRAS-Mutant Non-Small Cell Lung Cancer: The End of the Beginning for Targeted Therapies.,"['Kaufman, Jacob', 'Stinchcombe, Thomas E']","Kaufman, Jacob",Duke University,"Stinchcombe, Thomas E",Duke Cancer Institute,,29,,JAMA,2017 May 9,
"Introducing ""Genomics and Precision Health"".","['Feero, W Gregory']","Feero, W Gregory",MaineGeneral Health,"Feero, W Gregory",MaineGeneral Health,,19,,JAMA,2017 May 9,
Incorrect Funder.,,,,,,,,,JAMA,2017 May 9,
Misspelling of Author Name.,,,,,,,,,JAMA,2017 May 9,
Incorrect Unit of Measure.,,,,,,,,,JAMA,2017 May 9,
Maker of Duodenoscopes Under Scrutiny Again.,"['Lyon, Jeff']","Lyon, Jeff",Walter Reed Army Institute of Research,"Lyon, Jeff",Walter Reed Army Institute of Research,,30,,JAMA,2017 May 9,
Hearing Focuses on Proposed Cuts in Cancer Research.,"['Lyon, Jeff']","Lyon, Jeff",Walter Reed Army Institute of Research,"Lyon, Jeff",Walter Reed Army Institute of Research,,30,,JAMA,2017 May 9,
Investigation Into Opioid Crisis Targets Drug Companies.,"['Lyon, Jeff']","Lyon, Jeff",Walter Reed Army Institute of Research,"Lyon, Jeff",Walter Reed Army Institute of Research,,30,,JAMA,2017 May 9,
"The Center Cannot Hold: Medicine, Music, and the Mind.","['Willich, Stefan N']","Willich, Stefan N",Charité  Universitätsmedizin Berlin,"Willich, Stefan N",Charité  Universitätsmedizin Berlin,,67,,JAMA,2017 May 9,
"Association Between Long-Lasting Intravitreous Fluocinolone Acetonide Implant vs Systemic Anti-inflammatory Therapy and Visual Acuity at 7 Years Among Patients With Intermediate, Posterior, or Panuveitis.","['Kempen, John H', 'Altaweel, Michael M', 'Holbrook, Janet T', 'Sugar, Elizabeth A', 'Thorne, Jennifer E', 'Jabs, Douglas A']","Kempen, John H",Massachusetts Eye and Ear Infirmary,"Jabs, Douglas A",Johns Hopkins Bloomberg School of Public Health,,67,"Importance: A randomized clinical trial comparing fluocinolone acetonide implant vs systemic corticosteroids and immunosuppression for treatment of severe noninfectious intermediate, posterior, and panuveitides did not result in a significant difference in visual acuity at 2 and 4.5 years; longer-term outcomes are not known. Objective: To compare the association between intravitreous fluocinolone acetonide implant vs systemic therapy and long-term visual and other outcomes in patients with uveitis. Design, Setting, and Participants: Nonprespecified 7-year observational follow-up of the Multicenter Uveitis Steroid Treatment (MUST) randomized clinical trial comparing the alternative treatments. Follow-up was conducted in tertiary uveitis subspecialty practices in the United States (21), the United Kingdom (1), and Australia (1). Of 255 patients 13 years or older with intermediate, posterior, or panuveitis (active within </=60 days) enrolled in the MUST trial between December 6, 2005, and December 9, 2008, 215 consented to ongoing follow-up through at least 7 years postrandomization (last visit, February 10, 2016). Interventions: Participants had been randomized to receive a surgically placed intravitreous fluocinolone acetonide implant or systemic corticosteroids supplemented by immunosuppression. When both eyes required treatment, both eyes were treated. Main Outcomes and Measures: Primary outcome was change from baseline in best-corrected visual acuity in uveitic eyes (5 letters = 1 visual acuity chart line; potential range of change in letters read, -121 to +101; minimal clinically important difference, 7 letters), analyzed by treatment assignment accounting for nonindependence of eyes when patients had 2 uveitic eyes. Secondary outcomes included potential systemic toxicities of corticosteroid and immunosuppressive therapy and death. Results: Seven-year data were obtained for 161 uveitic eyes (70% of 90 patients assigned to implant) and 167 uveitic eyes (71% of 90 patients assigned to systemic therapy) (77% female; median age at enrollment, 48 [interquartile range, 36-56] years). Change in mean visual acuity from baseline (implant, 61.7; systemic therapy, 65.0) through 7 years (implant, 55.8; systemic therapy, 66.2) favored systemic therapy by 7.2 (95% CI, 2.1-12) letters. Among protocol-specified, prospectively collected systemic adverse outcomes, the cumulative 7-year incidence in the implant and systemic therapy groups, respectively, was less than 10%, with the exceptions of hyperlipidemia (6.1% vs 11.2%), hypertension (9.8% vs 18.4%), osteopenia (41.5% vs 43.1%), fractures (11.3% vs 18.6%), hospitalization (47.6% vs 42.3%), and antibiotic-treated infection (57.4% vs 72.3%). Conclusions and Relevance: In 7-year extended follow-up of a randomized trial of patients with severe intermediate, posterior, or panuveitis, those randomized to receive systemic therapy had better visual acuity than those randomized to receive intravitreous fluocinolone acetonide implants. Study interpretation is limited by loss to follow-up. Trial Registration: clinicaltrials.gov Identifier: NCT00132691.",JAMA,2017 May 16,['U10 EY014656/EY/NEI NIH HHS/United States']
Permanent GME Funding for Teaching Health Centers.,"['Durfey, Shayla N M', 'George, Paul', 'Adashi, Eli Y']","Durfey, Shayla N M",Brown University,"Adashi, Eli Y",Brown University,,60,,JAMA,2017 Jun 13,
Value-Based Payment Models for Community Health Centers: Time to (Cautiously) Take the Plunge?,"['Bhatia, Jay', 'Tobey, Rachel', 'Hochman, Michael']","Bhatia, Jay",New York Methodist Hospital,"Hochman, Michael",Keck School of Medicine of USC,,7,,JAMA,2017 Jun 13,
The Paternal Epigenome Makes Its Mark.,"['Abbasi, Jennifer']","Abbasi, Jennifer",Journal of American Medical Association,"Abbasi, Jennifer",Journal of American Medical Association,,4,,JAMA,2017 May 23,
Conflict of Interest and Legal Issues for Investigators and Authors.,"['Thornton, Joseph P']","Thornton, Joseph P","John H. Stroger, Jr. Hospital of Cook County","Thornton, Joseph P","John H. Stroger, Jr. Hospital of Cook County",,3,,JAMA,2017 May 2,
Managing Conflicts of Interest in Industry-Sponsored Clinical Research: More Physician Engagement Is Required.,"['Waldstreicher, Joanne', 'Johns, Michael E']","Waldstreicher, Joanne",Merck Research Laboratories,"Johns, Michael E",Emory University,,39,,JAMA,2017 May 2,
Strategies for Addressing a Broader Definition of Conflicts of Interest.,"['McKinney, Ross E Jr', 'Pierce, Heather H']","McKinney, Ross E Jr",Duke University School of Medicine,"Pierce, Heather H",University of Kentucky HealthCare,,9,,JAMA,2017 May 2,
Addressing Bias and Conflict of Interest Among Biomedical Researchers.,"['Bero, Lisa']","Bero, Lisa",The University of Sydney,"Bero, Lisa",The University of Sydney,,53,,JAMA,2017 May 2,
Conflict of Interest and the Role of the Food Industry in Nutrition Research.,"['Mozaffarian, Dariush']","Mozaffarian, Dariush",Tufts University,"Mozaffarian, Dariush",Tufts University,,96,,JAMA,2017 May 2,
"Medical Journals, Publishers, and Conflict of Interest.","['Easley, Thomas J']","Easley, Thomas J",Harborview Injury Prevention and Research Center,"Easley, Thomas J",Harborview Injury Prevention and Research Center,,3,,JAMA,2017 May 2,
Conflict of Interest and the Integrity of the Medical Profession.,"['Lichter, Allen S']","Lichter, Allen S",National Cancer Institute,"Lichter, Allen S",National Cancer Institute,,63,,JAMA,2017 May 2,
What Do Patients Think About Physicians' Conflicts of Interest?: Watching Transparency Evolve.,"['Zuger, Abigail']","Zuger, Abigail",Sinai Health System,"Zuger, Abigail",Sinai Health System,,12,,JAMA,2017 May 2,
Financial Conflicts of Interest in Continuing Medical Education: Implications and Accountability.,"['Barnes, Barbara']","Barnes, Barbara","University of California, San Francisco","Barnes, Barbara","University of California, San Francisco",,7,,JAMA,2017 May 2,
Conflict of Interest in Practice Guidelines Panels.,"['Sox, Harold C']","Sox, Harold C",Patient-Centered Outcomes Research Institute,"Sox, Harold C",Patient-Centered Outcomes Research Institute,,53,,JAMA,2017 May 2,
Challenges and Opportunities in Disclosing Financial Interests to Patients.,"['Armstrong, Katrina', 'Freiberg, Andrew A']","Armstrong, Katrina",Massachusetts General Hospital,"Freiberg, Andrew A",Massachusetts General Hospital,,26,,JAMA,2017 May 2,
Public Disclosure of Payments to Physicians From Industry.,"['Ornstein, Charles']","Ornstein, Charles",Columbia University in the City of New York,"Ornstein, Charles",Columbia University in the City of New York,,1,,JAMA,2017 May 2,
Role of Leaders in Fostering Meaningful Collaborations Between Academic Medical Centers and Industry While Also Managing Individual and Institutional Conflicts of Interest.,"['Pizzo, Philip A', 'Lawley, Thomas J', 'Rubenstein, Arthur H']","Pizzo, Philip A",Stanford University,"Rubenstein, Arthur H",University of Pennsylvania,,61,,JAMA,2017 May 2,
Conflicts of Interest and Professional Medical Associations: Progress and Remaining Challenges.,"['Nissen, Steven E']","Nissen, Steven E",Cleveland Clinic Foundation,"Nissen, Steven E",Cleveland Clinic Foundation,,81,,JAMA,2017 May 2,
"Physicians, Industry Payments for Food and Beverages, and Drug Prescribing.","['Steinbrook, Robert']","Steinbrook, Robert",JAMA Internal Medicine,"Steinbrook, Robert",JAMA Internal Medicine,,39,,JAMA,2017 May 2,
"Why There Are No ""Potential"" Conflicts of Interest.","['McCoy, Matthew S', 'Emanuel, Ezekiel J']","McCoy, Matthew S",University of Pennsylvania,"Emanuel, Ezekiel J",University of Pennsylvania,,74,,JAMA,2017 May 2,
Business Model-Related Conflict of Interests in Medicine: Problems and Potential Solutions.,"['Larkin, Ian', 'Loewenstein, George']","Larkin, Ian",UCLA Anderson School of Management,"Loewenstein, George",Carnegie Mellon University,,81,,JAMA,2017 May 2,
"How Should Journals Handle the Conflict of Interest of Their Editors?: Who Watches the ""Watchers""?","['Gottlieb, Julie D', 'Bressler, Neil M']","Gottlieb, Julie D",Johns Hopkins University,"Bressler, Neil M",The Wilmer Eye Institute at Johns Hopkins,,75,,JAMA,2017 May 2,
Teaching Medical Students About Conflicts of Interest.,"['Wayne, Diane B', 'Green, Marianne', 'Neilson, Eric G']","Wayne, Diane B",Northwestern University Feinberg School of Medicine,"Neilson, Eric G",Northwestern University Feinberg School of Medicine,,67,,JAMA,2017 May 2,
Payments to Physicians: Does the Amount of Money Make a Difference?,"['Lo, Bernard', 'Grady, Deborah']","Lo, Bernard",Greenwall Foundation,"Grady, Deborah","University of California, San Francisco",,76,,JAMA,2017 May 2,
Conflict of Interest: Why Does It Matter?,"['Fineberg, Harvey V']","Fineberg, Harvey V",Gordon E. and Betty I. Moore Foundation,"Fineberg, Harvey V",Gordon E. and Betty I. Moore Foundation,,33,,JAMA,2017 May 2,
Conflict of Interest Among Medical School Faculty: Achieving a Coherent and Objective Approach.,"['Flier, Jeffrey S']","Flier, Jeffrey S",Harvard Medical School,"Flier, Jeffrey S",Harvard Medical School,,145,,JAMA,2017 May 2,
"Funding, Institutional Conflicts of Interest, and Schools of Public Health: Realities and Solutions.","['Galea, Sandro', 'Saitz, Richard']","Galea, Sandro",Boston University School of Public Health,"Saitz, Richard",Boston University School of Public Health,,44,,JAMA,2017 May 2,
Is There a Conflict of Interest?,"['Ginsburg, Shiphra', 'Levinson, Wendy']","Ginsburg, Shiphra",University of Toronto,"Levinson, Wendy",University of Toronto,,57,,JAMA,2017 May 2,
After the Medical Error.,"['Worthen, Miranda']","Worthen, Miranda",San Jose State University,"Worthen, Miranda",San Jose State University,,6,,JAMA,2017 May 2,
Conflict of Interest in Medicine.,"['Muth, Christopher C']","Muth, Christopher C",Journal of American Medical Association,"Muth, Christopher C",Journal of American Medical Association,,2,,JAMA,2017 May 2,
Association Between Academic Medical Center Pharmaceutical Detailing Policies and Physician Prescribing.,"['Larkin, Ian', 'Ang, Desmond', 'Steinhart, Jonathan', 'Chao, Matthew', 'Patterson, Mark', 'Sah, Sunita', 'Wu, Tina', 'Schoenbaum, Michael', 'Hutchins, David', 'Brennan, Troyen', 'Loewenstein, George']","Larkin, Ian",UCLA Anderson School of Management,"Loewenstein, George",Carnegie Mellon University,,81,"Importance: In an effort to regulate physician conflicts of interest, some US academic medical centers (AMCs) enacted policies restricting pharmaceutical representative sales visits to physicians (known as detailing) between 2006 and 2012. Little is known about the effect of these policies on physician prescribing. Objective: To analyze the association between detailing policies enacted at AMCs and physician prescribing of actively detailed and not detailed drugs. Design, Setting, and Participants: The study used a difference-in-differences multivariable regression analysis to compare changes in prescribing by physicians before and after implementation of detailing policies at AMCs in 5 states (California, Illinois, Massachusetts, Pennsylvania, and New York) that made up the intervention group with changes in prescribing by a matched control group of similar physicians not subject to a detailing policy. Exposures: Academic medical center implementation of policies regulating pharmaceutical salesperson visits to attending physicians. Main Outcomes and Measures: The monthly within-drug class market share of prescriptions written by an individual physician for detailed and nondetailed drugs in 8 drug classes (lipid-lowering drugs, gastroesophageal reflux disease drugs, diabetes drugs, antihypertensive drugs, hypnotic drugs approved for the treatment of insomnia [sleep aids], attention-deficit/hyperactivity disorder drugs, antidepressant drugs, and antipsychotic drugs) comparing the 10- to 36-month period before implementation of the detailing policies with the 12- to 36-month period after implementation, depending on data availability. Results: The analysis included 16121483 prescriptions written between January 2006 and June 2012 by 2126 attending physicians at the 19 intervention group AMCs and by 24593 matched control group physicians. The sample mean market share at the physician-drug-month level for detailed and nondetailed drugs prior to enactment of policies was 19.3% and 14.2%, respectively. Exposure to an AMC detailing policy was associated with a decrease in the market share of detailed drugs of 1.67 percentage points (95% CI, -2.18 to -1.18 percentage points; P < .001) and an increase in the market share of nondetailed drugs of 0.84 percentage points (95% CI, 0.54 to 1.14 percentage points; P < .001). Associations were statistically significant for 6 of 8 study drug classes for detailed drugs (lipid-lowering drugs, gastroesophageal reflux disease drugs, antihypertensive drugs, sleep aids, attention-deficit/hyperactivity disorder drugs, and antidepressant drugs) and for 9 of the 19 AMCs that implemented policies. Eleven of the 19 AMCs regulated salesperson gifts to physicians, restricted salesperson access to facilities, and incorporated explicit enforcement mechanisms. For 8 of these 11 AMCs, there was a significant change in prescribing. In contrast, there was a significant change at only 1 of 8 AMCs that did not enact policies in all 3 areas. Conclusions and Relevance: Implementation of policies at AMCs that restricted pharmaceutical detailing between 2006 and 2012 was associated with modest but significant reductions in prescribing of detailed drugs across 6 of 8 major drug classes; however, changes were not seen in all of the AMCs that enacted policies.",JAMA,2017 May 2,
